[
  {
    "schemaVersion": "kaoyan-existing-question-1.0",
    "source": "production",
    "articleKey": "ky-en1-2000-r-t4",
    "qIndex": 23,
    "questionNumber": 23,
    "stem": "In the Westerners' eyes, postwar Japan was.",
    "stemTranslation": null,
    "options": [
      {
        "key": "A",
        "text": "under aimless development",
        "isCorrect": false,
        "distractorType": "过度推断",
        "analysis": "【干扰特征: 过度推断】选项 A 违背原文细节，存在明显的逻辑偏差或概念偷换。",
        "refSentences": [
          "P1-S1",
          "P2-S1"
        ]
      },
      {
        "key": "B",
        "text": "a positive example",
        "isCorrect": true,
        "distractorType": null,
        "analysis": "【正确项 · 同义替换】选项 B 严格遵循题干定位句的核心事实逻辑，通过同义表达精准契合原文论断。",
        "refSentences": [
          "P1-S1",
          "P2-S1"
        ]
      },
      {
        "key": "C",
        "text": "a rival to the West",
        "isCorrect": false,
        "distractorType": "偷换概念",
        "analysis": "【干扰特征: 偷换概念】选项 C 违背原文细节，存在明显的逻辑偏差或概念偷换。",
        "refSentences": [
          "P1-S1",
          "P2-S1"
        ]
      },
      {
        "key": "D",
        "text": "on the decline",
        "isCorrect": false,
        "distractorType": "正反混淆",
        "analysis": "【干扰特征: 正反混淆】选项 D 违背原文细节，存在明显的逻辑偏差或概念偷换。",
        "refSentences": [
          "P1-S1",
          "P2-S1"
        ]
      }
    ],
    "officialAnswer": "B",
    "standardType": null,
    "type": "词义句意题",
    "targetSentences": [
      "P1-S1",
      "P2-S1"
    ],
    "verbatimEvidence": null,
    "synonymMapping": null,
    "methodologyReview": {
      "trapAnalysis": "第 23 题重点考查定位句与选项之间的同义替换精准度，注意排除干扰项的干扰特征。",
      "methodSummary": "细节题直选与排除法则：抓准题干核心关键词快速定位，对比定位句语义，排除无中生有与偷换概念选项。"
    },
    "paperVariants": null,
    "rawFields": {
      "stemKeywords": [
        "Westerners",
        "eyes",
        "postwar"
      ]
    },
    "provenance": {
      "sourceLayer": "production",
      "sourceFile": "题库/英语/data_2000.js",
      "year": 2000,
      "articleKey": "ky-en1-2000-r-t4",
      "extractedAt": "2026-09-18T23:13:00+0800",
      "contentHash": "sha256:3f9a5388ad11097f9557bbf5154a5917cfd6524a94745a49b350362d9a74b695"
    }
  },
  {
    "schemaVersion": "kaoyan-existing-question-1.0",
    "source": "production",
    "articleKey": "ky-en1-2000-r-t4",
    "qIndex": 24,
    "questionNumber": 24,
    "stem": "According to the author, what may chiefly be responsible for the moral decline of Japanese society?",
    "stemTranslation": null,
    "options": [
      {
        "key": "A",
        "text": "Women's participation in social activities is limited.",
        "isCorrect": false,
        "distractorType": "绝对化词汇",
        "analysis": "【干扰特征: 绝对化词汇】选项 A 违背原文细节，存在明显的逻辑偏差或概念偷换。",
        "refSentences": [
          "P1-S1",
          "P2-S1"
        ]
      },
      {
        "key": "B",
        "text": "More workers are dissatisfied with their jobs.",
        "isCorrect": false,
        "distractorType": "偷换概念",
        "analysis": "【干扰特征: 偷换概念】选项 B 违背原文细节，存在明显的逻辑偏差或概念偷换。",
        "refSentences": [
          "P1-S1",
          "P2-S1"
        ]
      },
      {
        "key": "C",
        "text": "Excessive emphasis has been placed on the basics.",
        "isCorrect": false,
        "distractorType": "正反混淆",
        "analysis": "【干扰特征: 正反混淆】选项 C 违背原文细节，存在明显的逻辑偏差或概念偷换。",
        "refSentences": [
          "P1-S1",
          "P2-S1"
        ]
      },
      {
        "key": "D",
        "text": "The life-style has been influenced by Western values.",
        "isCorrect": true,
        "distractorType": null,
        "analysis": "【正确项 · 同义替换】选项 D 严格遵循题干定位句的核心事实逻辑，通过同义表达精准契合原文论断。",
        "refSentences": [
          "P1-S1",
          "P2-S1"
        ]
      }
    ],
    "officialAnswer": "D",
    "standardType": null,
    "type": "主旨大意题",
    "targetSentences": [
      "P1-S1",
      "P2-S1"
    ],
    "verbatimEvidence": null,
    "synonymMapping": null,
    "methodologyReview": {
      "trapAnalysis": "第 24 题重点考查定位句与选项之间的同义替换精准度，注意排除干扰项的干扰特征。",
      "methodSummary": "细节题直选与排除法则：抓准题干核心关键词快速定位，对比定位句语义，排除无中生有与偷换概念选项。"
    },
    "paperVariants": null,
    "rawFields": {
      "stemKeywords": [
        "According",
        "author",
        "what"
      ]
    },
    "provenance": {
      "sourceLayer": "production",
      "sourceFile": "题库/英语/data_2000.js",
      "year": 2000,
      "articleKey": "ky-en1-2000-r-t4",
      "extractedAt": "2026-09-18T23:13:00+0800",
      "contentHash": "sha256:3f9a5388ad11097f9557bbf5154a5917cfd6524a94745a49b350362d9a74b695"
    }
  },
  {
    "schemaVersion": "kaoyan-existing-question-1.0",
    "source": "production",
    "articleKey": "ky-en1-2000-r-t4",
    "qIndex": 25,
    "questionNumber": 25,
    "stem": "Which of the following is true according to the author?",
    "stemTranslation": null,
    "options": [
      {
        "key": "A",
        "text": "Japanese education is praised for helping the young climb the social ladder.",
        "isCorrect": false,
        "distractorType": "偷换概念",
        "analysis": "【干扰特征: 偷换概念】选项 A 违背原文细节，存在明显的逻辑偏差或概念偷换。",
        "refSentences": [
          "P1-S1",
          "P2-S1"
        ]
      },
      {
        "key": "B",
        "text": "Japanese education is characterized by mechanical learning as well as creativity.",
        "isCorrect": false,
        "distractorType": "正反混淆",
        "analysis": "【干扰特征: 正反混淆】选项 B 违背原文细节，存在明显的逻辑偏差或概念偷换。",
        "refSentences": [
          "P1-S1",
          "P2-S1"
        ]
      },
      {
        "key": "C",
        "text": "More stress should be placed on the cultivation of creativity.",
        "isCorrect": true,
        "distractorType": null,
        "analysis": "【正确项 · 同义替换】选项 C 严格遵循题干定位句的核心事实逻辑，通过同义表达精准契合原文论断。",
        "refSentences": [
          "P1-S1",
          "P2-S1"
        ]
      },
      {
        "key": "D",
        "text": "Dropping out leads to frustration against test taking.",
        "isCorrect": false,
        "distractorType": "无中生有",
        "analysis": "【干扰特征: 无中生有】选项 D 违背原文细节，存在明显的逻辑偏差或概念偷换。",
        "refSentences": [
          "P1-S1",
          "P2-S1"
        ]
      }
    ],
    "officialAnswer": "C",
    "standardType": null,
    "type": "观点态度题",
    "targetSentences": [
      "P1-S1",
      "P2-S1"
    ],
    "verbatimEvidence": null,
    "synonymMapping": null,
    "methodologyReview": {
      "trapAnalysis": "第 25 题重点考查定位句与选项之间的同义替换精准度，注意排除干扰项的干扰特征。",
      "methodSummary": "细节题直选与排除法则：抓准题干核心关键词快速定位，对比定位句语义，排除无中生有与偷换概念选项。"
    },
    "paperVariants": null,
    "rawFields": {
      "stemKeywords": [
        "Which",
        "following",
        "true"
      ]
    },
    "provenance": {
      "sourceLayer": "production",
      "sourceFile": "题库/英语/data_2000.js",
      "year": 2000,
      "articleKey": "ky-en1-2000-r-t4",
      "extractedAt": "2026-09-18T23:13:00+0800",
      "contentHash": "sha256:3f9a5388ad11097f9557bbf5154a5917cfd6524a94745a49b350362d9a74b695"
    }
  },
  {
    "schemaVersion": "kaoyan-existing-question-1.0",
    "source": "production",
    "articleKey": "ky-en1-2000-r-t4",
    "qIndex": 26,
    "questionNumber": 26,
    "stem": "The change in Japanese life-style is revealed in the fact that.",
    "stemTranslation": null,
    "options": [
      {
        "key": "A",
        "text": "the young are less tolerant of discomforts in life",
        "isCorrect": true,
        "distractorType": null,
        "analysis": "【正确项 · 同义替换】选项 A 严格遵循题干定位句的核心事实逻辑，通过同义表达精准契合原文论断。",
        "refSentences": [
          "P1-S1",
          "P2-S1"
        ]
      },
      {
        "key": "B",
        "text": "the divorce rate in Japan exceeds that in the U.S.",
        "isCorrect": false,
        "distractorType": "以偏概全",
        "analysis": "【干扰特征: 以偏概全】选项 B 违背原文细节，存在明显的逻辑偏差或概念偷换。",
        "refSentences": [
          "P1-S1",
          "P2-S1"
        ]
      },
      {
        "key": "C",
        "text": "the Japanese endure more than ever before",
        "isCorrect": false,
        "distractorType": "无中生有",
        "analysis": "【干扰特征: 无中生有】选项 C 违背原文细节，存在明显的逻辑偏差或概念偷换。",
        "refSentences": [
          "P1-S1",
          "P2-S1"
        ]
      },
      {
        "key": "D",
        "text": "the Japanese appreciate their present life",
        "isCorrect": false,
        "distractorType": "过度推断",
        "analysis": "【干扰特征: 过度推断】选项 D 违背原文细节，存在明显的逻辑偏差或概念偷换。",
        "refSentences": [
          "P1-S1",
          "P2-S1"
        ]
      }
    ],
    "officialAnswer": "A",
    "standardType": null,
    "type": "细节事实题",
    "targetSentences": [
      "P1-S1",
      "P2-S1"
    ],
    "verbatimEvidence": null,
    "synonymMapping": null,
    "methodologyReview": {
      "trapAnalysis": "第 26 题重点考查定位句与选项之间的同义替换精准度，注意排除干扰项的干扰特征。",
      "methodSummary": "细节题直选与排除法则：抓准题干核心关键词快速定位，对比定位句语义，排除无中生有与偷换概念选项。"
    },
    "paperVariants": null,
    "rawFields": {
      "stemKeywords": [
        "change",
        "Japanese",
        "life"
      ]
    },
    "provenance": {
      "sourceLayer": "production",
      "sourceFile": "题库/英语/data_2000.js",
      "year": 2000,
      "articleKey": "ky-en1-2000-r-t4",
      "extractedAt": "2026-09-18T23:13:00+0800",
      "contentHash": "sha256:3f9a5388ad11097f9557bbf5154a5917cfd6524a94745a49b350362d9a74b695"
    }
  }
]