[
  {
    "schemaVersion": "kaoyan-existing-question-1.0",
    "source": "production",
    "articleKey": "ky-en1-2001-r-t1",
    "qIndex": 21,
    "questionNumber": 21,
    "stem": "The growth of specialisation in the 19th century might be more clearly seen in sciences such as \\_\\_\\_\\_\\_\\_\\_.",
    "stemTranslation": null,
    "options": [
      {
        "key": "A",
        "text": "sociology and chemistry",
        "isCorrect": false,
        "distractorType": "以偏概全",
        "analysis": "【干扰特征: 以偏概全】选项 A 违背原文细节，存在明显的逻辑偏差或概念偷换。",
        "refSentences": [
          "P1-S1",
          "P2-S1"
        ]
      },
      {
        "key": "B",
        "text": "physics and psychology",
        "isCorrect": false,
        "distractorType": "无中生有",
        "analysis": "【干扰特征: 无中生有】选项 B 违背原文细节，存在明显的逻辑偏差或概念偷换。",
        "refSentences": [
          "P1-S1",
          "P2-S1"
        ]
      },
      {
        "key": "C",
        "text": "sociology and psychology",
        "isCorrect": false,
        "distractorType": "过度推断",
        "analysis": "【干扰特征: 过度推断】选项 C 违背原文细节，存在明显的逻辑偏差或概念偷换。",
        "refSentences": [
          "P1-S1",
          "P2-S1"
        ]
      },
      {
        "key": "D",
        "text": "physics and chemistry",
        "isCorrect": true,
        "distractorType": null,
        "analysis": "【正确项 · 同义替换】选项 D 严格遵循题干定位句的核心事实逻辑，通过同义表达精准契合原文论断。",
        "refSentences": [
          "P1-S1",
          "P2-S1"
        ]
      }
    ],
    "officialAnswer": "D",
    "standardType": null,
    "type": "细节事实题",
    "targetSentences": [
      "P1-S1",
      "P2-S1"
    ],
    "verbatimEvidence": null,
    "synonymMapping": null,
    "methodologyReview": {
      "trapAnalysis": "第 21 题重点考查定位句与选项之间的同义替换精准度，注意排除干扰项的干扰特征。",
      "methodSummary": "细节题直选与排除法则：抓准题干核心关键词快速定位，对比定位句语义，排除无中生有与偷换概念选项。"
    },
    "paperVariants": null,
    "rawFields": {
      "stemKeywords": [
        "growth",
        "specialisation",
        "century"
      ]
    },
    "provenance": {
      "sourceLayer": "production",
      "sourceFile": "题库/英语/data_2001.js",
      "year": 2001,
      "articleKey": "ky-en1-2001-r-t1",
      "extractedAt": "2026-09-18T23:13:00+0800",
      "contentHash": "sha256:5a2c1911d69a28b8b824d35c5138024b9b11ad53f32aa3c4864cafb447a302fd"
    }
  },
  {
    "schemaVersion": "kaoyan-existing-question-1.0",
    "source": "production",
    "articleKey": "ky-en1-2001-r-t1",
    "qIndex": 22,
    "questionNumber": 22,
    "stem": "We can infer from the passage that \\_\\_\\_\\_\\_\\_\\_.",
    "stemTranslation": null,
    "options": [
      {
        "key": "A",
        "text": "there is little distinction between specialisation and professionalisation",
        "isCorrect": true,
        "distractorType": null,
        "analysis": "【正确项 · 同义替换】选项 A 严格遵循题干定位句的核心事实逻辑，通过同义表达精准契合原文论断。",
        "refSentences": [
          "P1-S1",
          "P2-S1"
        ]
      },
      {
        "key": "B",
        "text": "amateurs can compete with professionals in some areas of science",
        "isCorrect": false,
        "distractorType": "过度推断",
        "analysis": "【干扰特征: 过度推断】选项 B 违背原文细节，存在明显的逻辑偏差或概念偷换。",
        "refSentences": [
          "P1-S1",
          "P2-S1"
        ]
      },
      {
        "key": "C",
        "text": "professionals tend to welcome amateurs into the scientific community",
        "isCorrect": false,
        "distractorType": "绝对化词汇",
        "analysis": "【干扰特征: 绝对化词汇】选项 C 违背原文细节，存在明显的逻辑偏差或概念偷换。",
        "refSentences": [
          "P1-S1",
          "P2-S1"
        ]
      },
      {
        "key": "D",
        "text": "amateurs have national academic societies but no local ones",
        "isCorrect": false,
        "distractorType": "偷换概念",
        "analysis": "【干扰特征: 偷换概念】选项 D 违背原文细节，存在明显的逻辑偏差或概念偷换。",
        "refSentences": [
          "P1-S1",
          "P2-S1"
        ]
      }
    ],
    "officialAnswer": "A",
    "standardType": null,
    "type": "推断判断题",
    "targetSentences": [
      "P1-S1",
      "P2-S1"
    ],
    "verbatimEvidence": null,
    "synonymMapping": null,
    "methodologyReview": {
      "trapAnalysis": "第 22 题重点考查定位句与选项之间的同义替换精准度，注意排除干扰项的干扰特征。",
      "methodSummary": "细节题直选与排除法则：抓准题干核心关键词快速定位，对比定位句语义，排除无中生有与偷换概念选项。"
    },
    "paperVariants": null,
    "rawFields": {
      "stemKeywords": [
        "infer",
        "from",
        "passage"
      ]
    },
    "provenance": {
      "sourceLayer": "production",
      "sourceFile": "题库/英语/data_2001.js",
      "year": 2001,
      "articleKey": "ky-en1-2001-r-t1",
      "extractedAt": "2026-09-18T23:13:00+0800",
      "contentHash": "sha256:5a2c1911d69a28b8b824d35c5138024b9b11ad53f32aa3c4864cafb447a302fd"
    }
  },
  {
    "schemaVersion": "kaoyan-existing-question-1.0",
    "source": "production",
    "articleKey": "ky-en1-2001-r-t1",
    "qIndex": 23,
    "questionNumber": 23,
    "stem": "The author writes of the development of geology to demonstrate ______.",
    "stemTranslation": null,
    "options": [
      {
        "key": "A",
        "text": "the process of specialisation and professionalisation",
        "isCorrect": false,
        "distractorType": "过度推断",
        "analysis": "【干扰特征: 过度推断】选项 A 违背原文细节，存在明显的逻辑偏差或概念偷换。",
        "refSentences": [
          "P1-S1",
          "P2-S1"
        ]
      },
      {
        "key": "B",
        "text": "the hardship of amateurs in scientific study",
        "isCorrect": false,
        "distractorType": "绝对化词汇",
        "analysis": "【干扰特征: 绝对化词汇】选项 B 违背原文细节，存在明显的逻辑偏差或概念偷换。",
        "refSentences": [
          "P1-S1",
          "P2-S1"
        ]
      },
      {
        "key": "C",
        "text": "the change of policies in scientific publications",
        "isCorrect": false,
        "distractorType": "偷换概念",
        "analysis": "【干扰特征: 偷换概念】选项 C 违背原文细节，存在明显的逻辑偏差或概念偷换。",
        "refSentences": [
          "P1-S1",
          "P2-S1"
        ]
      },
      {
        "key": "D",
        "text": "the discrimination of professionals against amateurs",
        "isCorrect": true,
        "distractorType": null,
        "analysis": "【正确项 · 同义替换】选项 D 严格遵循题干定位句的核心事实逻辑，通过同义表达精准契合原文论断。",
        "refSentences": [
          "P1-S1",
          "P2-S1"
        ]
      }
    ],
    "officialAnswer": "D",
    "standardType": null,
    "type": "词义句意题",
    "targetSentences": [
      "P1-S1",
      "P2-S1"
    ],
    "verbatimEvidence": null,
    "synonymMapping": null,
    "methodologyReview": {
      "trapAnalysis": "第 23 题重点考查定位句与选项之间的同义替换精准度，注意排除干扰项的干扰特征。",
      "methodSummary": "细节题直选与排除法则：抓准题干核心关键词快速定位，对比定位句语义，排除无中生有与偷换概念选项。"
    },
    "paperVariants": null,
    "rawFields": {
      "stemKeywords": [
        "author",
        "writes",
        "development"
      ]
    },
    "provenance": {
      "sourceLayer": "production",
      "sourceFile": "题库/英语/data_2001.js",
      "year": 2001,
      "articleKey": "ky-en1-2001-r-t1",
      "extractedAt": "2026-09-18T23:13:00+0800",
      "contentHash": "sha256:5a2c1911d69a28b8b824d35c5138024b9b11ad53f32aa3c4864cafb447a302fd"
    }
  },
  {
    "schemaVersion": "kaoyan-existing-question-1.0",
    "source": "production",
    "articleKey": "ky-en1-2001-r-t1",
    "qIndex": 24,
    "questionNumber": 24,
    "stem": "The direct reason for specialisation is _______.",
    "stemTranslation": null,
    "options": [
      {
        "key": "A",
        "text": "the development in communication",
        "isCorrect": false,
        "distractorType": "绝对化词汇",
        "analysis": "【干扰特征: 绝对化词汇】选项 A 违背原文细节，存在明显的逻辑偏差或概念偷换。",
        "refSentences": [
          "P1-S1",
          "P2-S1"
        ]
      },
      {
        "key": "B",
        "text": "the growth of professionalisation",
        "isCorrect": true,
        "distractorType": null,
        "analysis": "【正确项 · 同义替换】选项 B 严格遵循题干定位句的核心事实逻辑，通过同义表达精准契合原文论断。",
        "refSentences": [
          "P1-S1",
          "P2-S1"
        ]
      },
      {
        "key": "C",
        "text": "the expansion of scientific knowledge",
        "isCorrect": false,
        "distractorType": "正反混淆",
        "analysis": "【干扰特征: 正反混淆】选项 C 违背原文细节，存在明显的逻辑偏差或概念偷换。",
        "refSentences": [
          "P1-S1",
          "P2-S1"
        ]
      },
      {
        "key": "D",
        "text": "the splitting up of academic societies",
        "isCorrect": false,
        "distractorType": "以偏概全",
        "analysis": "【干扰特征: 以偏概全】选项 D 违背原文细节，存在明显的逻辑偏差或概念偷换。",
        "refSentences": [
          "P1-S1",
          "P2-S1"
        ]
      }
    ],
    "officialAnswer": "B",
    "standardType": null,
    "type": "主旨大意题",
    "targetSentences": [
      "P1-S1",
      "P2-S1"
    ],
    "verbatimEvidence": null,
    "synonymMapping": null,
    "methodologyReview": {
      "trapAnalysis": "第 24 题重点考查定位句与选项之间的同义替换精准度，注意排除干扰项的干扰特征。",
      "methodSummary": "细节题直选与排除法则：抓准题干核心关键词快速定位，对比定位句语义，排除无中生有与偷换概念选项。"
    },
    "paperVariants": null,
    "rawFields": {
      "stemKeywords": [
        "direct",
        "reason",
        "specialisation"
      ]
    },
    "provenance": {
      "sourceLayer": "production",
      "sourceFile": "题库/英语/data_2001.js",
      "year": 2001,
      "articleKey": "ky-en1-2001-r-t1",
      "extractedAt": "2026-09-18T23:13:00+0800",
      "contentHash": "sha256:5a2c1911d69a28b8b824d35c5138024b9b11ad53f32aa3c4864cafb447a302fd"
    }
  }
]