[
  {
    "schemaVersion": "kaoyan-existing-question-1.0",
    "source": "production",
    "articleKey": "ky-en1-1999-r-t2",
    "qIndex": 15,
    "questionNumber": 15,
    "stem": "We learn from the beginning of the passage that Web business\\_\\_\\_\\_\\_.",
    "stemTranslation": null,
    "options": [
      {
        "key": "A",
        "text": "has been striving to expand its market",
        "isCorrect": true,
        "distractorType": null,
        "analysis": "【正确项 · 同义替换】选项 A 严格遵循题干定位句的核心事实逻辑，通过同义表达精准契合原文论断。",
        "refSentences": [
          "P1-S1",
          "P2-S1"
        ]
      },
      {
        "key": "B",
        "text": "intended to follow a fanciful fashion",
        "isCorrect": false,
        "distractorType": "无中生有",
        "analysis": "【干扰特征: 无中生有】选项 B 违背原文细节，存在明显的逻辑偏差或概念偷换。",
        "refSentences": [
          "P1-S1",
          "P2-S1"
        ]
      },
      {
        "key": "C",
        "text": "tried but in vain to control the market",
        "isCorrect": false,
        "distractorType": "过度推断",
        "analysis": "【干扰特征: 过度推断】选项 C 违背原文细节，存在明显的逻辑偏差或概念偷换。",
        "refSentences": [
          "P1-S1",
          "P2-S1"
        ]
      },
      {
        "key": "D",
        "text": "has been booming for one year or so",
        "isCorrect": false,
        "distractorType": "绝对化词汇",
        "analysis": "【干扰特征: 绝对化词汇】选项 D 违背原文细节，存在明显的逻辑偏差或概念偷换。",
        "refSentences": [
          "P1-S1",
          "P2-S1"
        ]
      }
    ],
    "officialAnswer": "A",
    "standardType": null,
    "type": "观点态度题",
    "targetSentences": [
      "P1-S1",
      "P2-S1"
    ],
    "verbatimEvidence": null,
    "synonymMapping": null,
    "methodologyReview": {
      "trapAnalysis": "第 15 题重点考查定位句与选项之间的同义替换精准度，注意排除干扰项的干扰特征。",
      "methodSummary": "细节题直选与排除法则：抓准题干核心关键词快速定位，对比定位句语义，排除无中生有与偷换概念选项。"
    },
    "paperVariants": null,
    "rawFields": {
      "stemKeywords": [
        "learn",
        "from",
        "beginning"
      ]
    },
    "provenance": {
      "sourceLayer": "production",
      "sourceFile": "题库/英语/data_1999.js",
      "year": 1999,
      "articleKey": "ky-en1-1999-r-t2",
      "extractedAt": "2026-09-18T23:13:00+0800",
      "contentHash": "sha256:b1b48836140e58e97dfb702b0e6e3f26fd04e6d5b05afeb37a812d2d6474245a"
    }
  },
  {
    "schemaVersion": "kaoyan-existing-question-1.0",
    "source": "production",
    "articleKey": "ky-en1-1999-r-t2",
    "qIndex": 16,
    "questionNumber": 16,
    "stem": "Speaking of the online technology available for marketing, the author implies that_____.",
    "stemTranslation": null,
    "options": [
      {
        "key": "A",
        "text": "the technology is popular with many Web users",
        "isCorrect": false,
        "distractorType": "无中生有",
        "analysis": "【干扰特征: 无中生有】选项 A 违背原文细节，存在明显的逻辑偏差或概念偷换。",
        "refSentences": [
          "P1-S1",
          "P2-S1"
        ]
      },
      {
        "key": "B",
        "text": "businesses have faith in the reliability of online transactions",
        "isCorrect": false,
        "distractorType": "过度推断",
        "analysis": "【干扰特征: 过度推断】选项 B 违背原文细节，存在明显的逻辑偏差或概念偷换。",
        "refSentences": [
          "P1-S1",
          "P2-S1"
        ]
      },
      {
        "key": "C",
        "text": "there is a radical change in strategy",
        "isCorrect": true,
        "distractorType": null,
        "analysis": "【正确项 · 同义替换】选项 C 严格遵循题干定位句的核心事实逻辑，通过同义表达精准契合原文论断。",
        "refSentences": [
          "P1-S1",
          "P2-S1"
        ]
      },
      {
        "key": "D",
        "text": "it is accessible limitedly to established partners",
        "isCorrect": false,
        "distractorType": "偷换概念",
        "analysis": "【干扰特征: 偷换概念】选项 D 违背原文细节，存在明显的逻辑偏差或概念偷换。",
        "refSentences": [
          "P1-S1",
          "P2-S1"
        ]
      }
    ],
    "officialAnswer": "C",
    "standardType": null,
    "type": "细节事实题",
    "targetSentences": [
      "P1-S1",
      "P2-S1"
    ],
    "verbatimEvidence": null,
    "synonymMapping": null,
    "methodologyReview": {
      "trapAnalysis": "第 16 题重点考查定位句与选项之间的同义替换精准度，注意排除干扰项的干扰特征。",
      "methodSummary": "细节题直选与排除法则：抓准题干核心关键词快速定位，对比定位句语义，排除无中生有与偷换概念选项。"
    },
    "paperVariants": null,
    "rawFields": {
      "stemKeywords": [
        "Speaking",
        "online",
        "technology"
      ]
    },
    "provenance": {
      "sourceLayer": "production",
      "sourceFile": "题库/英语/data_1999.js",
      "year": 1999,
      "articleKey": "ky-en1-1999-r-t2",
      "extractedAt": "2026-09-18T23:13:00+0800",
      "contentHash": "sha256:b1b48836140e58e97dfb702b0e6e3f26fd04e6d5b05afeb37a812d2d6474245a"
    }
  },
  {
    "schemaVersion": "kaoyan-existing-question-1.0",
    "source": "production",
    "articleKey": "ky-en1-1999-r-t2",
    "qIndex": 17,
    "questionNumber": 17,
    "stem": "In the view of Net purists, _____.",
    "stemTranslation": null,
    "options": [
      {
        "key": "A",
        "text": "there should be no marketing messages in online culture",
        "isCorrect": false,
        "distractorType": "过度推断",
        "analysis": "【干扰特征: 过度推断】选项 A 违背原文细节，存在明显的逻辑偏差或概念偷换。",
        "refSentences": [
          "P1-S1",
          "P2-S1"
        ]
      },
      {
        "key": "B",
        "text": "money making should be given priority to on the Web",
        "isCorrect": false,
        "distractorType": "绝对化词汇",
        "analysis": "【干扰特征: 绝对化词汇】选项 B 违背原文细节，存在明显的逻辑偏差或概念偷换。",
        "refSentences": [
          "P1-S1",
          "P2-S1"
        ]
      },
      {
        "key": "C",
        "text": "the Web should be able to function as the television set",
        "isCorrect": false,
        "distractorType": "偷换概念",
        "analysis": "【干扰特征: 偷换概念】选项 C 违背原文细节，存在明显的逻辑偏差或概念偷换。",
        "refSentences": [
          "P1-S1",
          "P2-S1"
        ]
      },
      {
        "key": "D",
        "text": "there should be no online commercial information without requests",
        "isCorrect": true,
        "distractorType": null,
        "analysis": "【正确项 · 同义替换】选项 D 严格遵循题干定位句的核心事实逻辑，通过同义表达精准契合原文论断。",
        "refSentences": [
          "P1-S1",
          "P2-S1"
        ]
      }
    ],
    "officialAnswer": "D",
    "standardType": null,
    "type": "推断判断题",
    "targetSentences": [
      "P1-S1",
      "P2-S1"
    ],
    "verbatimEvidence": null,
    "synonymMapping": null,
    "methodologyReview": {
      "trapAnalysis": "第 17 题重点考查定位句与选项之间的同义替换精准度，注意排除干扰项的干扰特征。",
      "methodSummary": "细节题直选与排除法则：抓准题干核心关键词快速定位，对比定位句语义，排除无中生有与偷换概念选项。"
    },
    "paperVariants": null,
    "rawFields": {
      "stemKeywords": [
        "view",
        "purists"
      ]
    },
    "provenance": {
      "sourceLayer": "production",
      "sourceFile": "题库/英语/data_1999.js",
      "year": 1999,
      "articleKey": "ky-en1-1999-r-t2",
      "extractedAt": "2026-09-18T23:13:00+0800",
      "contentHash": "sha256:b1b48836140e58e97dfb702b0e6e3f26fd04e6d5b05afeb37a812d2d6474245a"
    }
  },
  {
    "schemaVersion": "kaoyan-existing-question-1.0",
    "source": "production",
    "articleKey": "ky-en1-1999-r-t2",
    "qIndex": 18,
    "questionNumber": 18,
    "stem": "We learn from the last paragraph that\\_\\_\\_\\_\\_.",
    "stemTranslation": null,
    "options": [
      {
        "key": "A",
        "text": "pushing information on the Web is essential to Internet commerce",
        "isCorrect": false,
        "distractorType": "绝对化词汇",
        "analysis": "【干扰特征: 绝对化词汇】选项 A 违背原文细节，存在明显的逻辑偏差或概念偷换。",
        "refSentences": [
          "P1-S1",
          "P2-S1"
        ]
      },
      {
        "key": "B",
        "text": "interactivity, hospitality and security are important to online customers",
        "isCorrect": true,
        "distractorType": null,
        "analysis": "【正确项 · 同义替换】选项 B 严格遵循题干定位句的核心事实逻辑，通过同义表达精准契合原文论断。",
        "refSentences": [
          "P1-S1",
          "P2-S1"
        ]
      },
      {
        "key": "C",
        "text": "leading companies began to take the online plunge decades ago",
        "isCorrect": false,
        "distractorType": "正反混淆",
        "analysis": "【干扰特征: 正反混淆】选项 C 违背原文细节，存在明显的逻辑偏差或概念偷换。",
        "refSentences": [
          "P1-S1",
          "P2-S1"
        ]
      },
      {
        "key": "D",
        "text": "setting up shops in silicon is independent of the cost of computing power",
        "isCorrect": false,
        "distractorType": "以偏概全",
        "analysis": "【干扰特征: 以偏概全】选项 D 违背原文细节，存在明显的逻辑偏差或概念偷换。",
        "refSentences": [
          "P1-S1",
          "P2-S1"
        ]
      }
    ],
    "officialAnswer": "B",
    "standardType": null,
    "type": "词义句意题",
    "targetSentences": [
      "P1-S1",
      "P2-S1"
    ],
    "verbatimEvidence": null,
    "synonymMapping": null,
    "methodologyReview": {
      "trapAnalysis": "第 18 题重点考查定位句与选项之间的同义替换精准度，注意排除干扰项的干扰特征。",
      "methodSummary": "细节题直选与排除法则：抓准题干核心关键词快速定位，对比定位句语义，排除无中生有与偷换概念选项。"
    },
    "paperVariants": null,
    "rawFields": {
      "stemKeywords": [
        "learn",
        "from",
        "last"
      ]
    },
    "provenance": {
      "sourceLayer": "production",
      "sourceFile": "题库/英语/data_1999.js",
      "year": 1999,
      "articleKey": "ky-en1-1999-r-t2",
      "extractedAt": "2026-09-18T23:13:00+0800",
      "contentHash": "sha256:b1b48836140e58e97dfb702b0e6e3f26fd04e6d5b05afeb37a812d2d6474245a"
    }
  }
]