[
  {
    "schemaVersion": "kaoyan-existing-question-1.0",
    "source": "production",
    "articleKey": "ky-en1-2001-r-t5",
    "qIndex": 37,
    "questionNumber": 37,
    "stem": "Which of the following is true according to paragraph 1?",
    "stemTranslation": null,
    "options": [
      {
        "key": "A",
        "text": "Full-time employment is a new international trend.",
        "isCorrect": false,
        "distractorType": "偷换概念",
        "analysis": "【干扰特征: 偷换概念】选项 A 违背原文细节，存在明显的逻辑偏差或概念偷换。",
        "refSentences": [
          "P1-S1",
          "P2-S1"
        ]
      },
      {
        "key": "B",
        "text": "The writer was compelled by circumstances to leave her job.",
        "isCorrect": false,
        "distractorType": "正反混淆",
        "analysis": "【干扰特征: 正反混淆】选项 B 违背原文细节，存在明显的逻辑偏差或概念偷换。",
        "refSentences": [
          "P1-S1",
          "P2-S1"
        ]
      },
      {
        "key": "C",
        "text": "\"A lateral move\" means stepping out of full-time employment.",
        "isCorrect": false,
        "distractorType": "以偏概全",
        "analysis": "【干扰特征: 以偏概全】选项 C 违背原文细节，存在明显的逻辑偏差或概念偷换。",
        "refSentences": [
          "P1-S1",
          "P2-S1"
        ]
      },
      {
        "key": "D",
        "text": "The writer was only too eager to spend more time with her family.",
        "isCorrect": true,
        "distractorType": null,
        "analysis": "【正确项 · 同义替换】选项 D 严格遵循题干定位句的核心事实逻辑，通过同义表达精准契合原文论断。",
        "refSentences": [
          "P1-S1",
          "P2-S1"
        ]
      }
    ],
    "officialAnswer": "D",
    "standardType": null,
    "type": "推断判断题",
    "targetSentences": [
      "P1-S1",
      "P2-S1"
    ],
    "verbatimEvidence": null,
    "synonymMapping": null,
    "methodologyReview": {
      "trapAnalysis": "第 37 题重点考查定位句与选项之间的同义替换精准度，注意排除干扰项的干扰特征。",
      "methodSummary": "细节题直选与排除法则：抓准题干核心关键词快速定位，对比定位句语义，排除无中生有与偷换概念选项。"
    },
    "paperVariants": null,
    "rawFields": {
      "stemKeywords": [
        "Which",
        "following",
        "true"
      ]
    },
    "provenance": {
      "sourceLayer": "production",
      "sourceFile": "题库/英语/data_2001.js",
      "year": 2001,
      "articleKey": "ky-en1-2001-r-t5",
      "extractedAt": "2026-09-18T23:13:00+0800",
      "contentHash": "sha256:5a2c1911d69a28b8b824d35c5138024b9b11ad53f32aa3c4864cafb447a302fd"
    }
  },
  {
    "schemaVersion": "kaoyan-existing-question-1.0",
    "source": "production",
    "articleKey": "ky-en1-2001-r-t5",
    "qIndex": 38,
    "questionNumber": 38,
    "stem": "The writer's experiment shows that downshifting ____",
    "stemTranslation": null,
    "options": [
      {
        "key": "A",
        "text": "enables her to realize her dream",
        "isCorrect": true,
        "distractorType": null,
        "analysis": "【正确项 · 同义替换】选项 A 严格遵循题干定位句的核心事实逻辑，通过同义表达精准契合原文论断。",
        "refSentences": [
          "P1-S1",
          "P2-S1"
        ]
      },
      {
        "key": "B",
        "text": "helps her mold a new philosophy of life",
        "isCorrect": false,
        "distractorType": "以偏概全",
        "analysis": "【干扰特征: 以偏概全】选项 B 违背原文细节，存在明显的逻辑偏差或概念偷换。",
        "refSentences": [
          "P1-S1",
          "P2-S1"
        ]
      },
      {
        "key": "C",
        "text": "prompts her to abandon her high social status",
        "isCorrect": false,
        "distractorType": "无中生有",
        "analysis": "【干扰特征: 无中生有】选项 C 违背原文细节，存在明显的逻辑偏差或概念偷换。",
        "refSentences": [
          "P1-S1",
          "P2-S1"
        ]
      },
      {
        "key": "D",
        "text": "leads her to accept the doctrine of She magazine",
        "isCorrect": false,
        "distractorType": "过度推断",
        "analysis": "【干扰特征: 过度推断】选项 D 违背原文细节，存在明显的逻辑偏差或概念偷换。",
        "refSentences": [
          "P1-S1",
          "P2-S1"
        ]
      }
    ],
    "officialAnswer": "A",
    "standardType": null,
    "type": "词义句意题",
    "targetSentences": [
      "P1-S1",
      "P2-S1"
    ],
    "verbatimEvidence": null,
    "synonymMapping": null,
    "methodologyReview": {
      "trapAnalysis": "第 38 题重点考查定位句与选项之间的同义替换精准度，注意排除干扰项的干扰特征。",
      "methodSummary": "细节题直选与排除法则：抓准题干核心关键词快速定位，对比定位句语义，排除无中生有与偷换概念选项。"
    },
    "paperVariants": null,
    "rawFields": {
      "stemKeywords": [
        "writer",
        "experiment",
        "shows"
      ]
    },
    "provenance": {
      "sourceLayer": "production",
      "sourceFile": "题库/英语/data_2001.js",
      "year": 2001,
      "articleKey": "ky-en1-2001-r-t5",
      "extractedAt": "2026-09-18T23:13:00+0800",
      "contentHash": "sha256:5a2c1911d69a28b8b824d35c5138024b9b11ad53f32aa3c4864cafb447a302fd"
    }
  },
  {
    "schemaVersion": "kaoyan-existing-question-1.0",
    "source": "production",
    "articleKey": "ky-en1-2001-r-t5",
    "qIndex": 39,
    "questionNumber": 39,
    "stem": "\"Juggling one's life\" probably means living a life characterized by_____.",
    "stemTranslation": null,
    "options": [
      {
        "key": "A",
        "text": "non-materialistic lifestyle",
        "isCorrect": false,
        "distractorType": "以偏概全",
        "analysis": "【干扰特征: 以偏概全】选项 A 违背原文细节，存在明显的逻辑偏差或概念偷换。",
        "refSentences": [
          "P1-S1",
          "P2-S1"
        ]
      },
      {
        "key": "B",
        "text": "a bit of everything",
        "isCorrect": false,
        "distractorType": "无中生有",
        "analysis": "【干扰特征: 无中生有】选项 B 违背原文细节，存在明显的逻辑偏差或概念偷换。",
        "refSentences": [
          "P1-S1",
          "P2-S1"
        ]
      },
      {
        "key": "C",
        "text": "extreme stress",
        "isCorrect": true,
        "distractorType": null,
        "analysis": "【正确项 · 同义替换】选项 C 严格遵循题干定位句的核心事实逻辑，通过同义表达精准契合原文论断。",
        "refSentences": [
          "P1-S1",
          "P2-S1"
        ]
      },
      {
        "key": "D",
        "text": "anti-consumerism",
        "isCorrect": false,
        "distractorType": "绝对化词汇",
        "analysis": "【干扰特征: 绝对化词汇】选项 D 违背原文细节，存在明显的逻辑偏差或概念偷换。",
        "refSentences": [
          "P1-S1",
          "P2-S1"
        ]
      }
    ],
    "officialAnswer": "C",
    "standardType": null,
    "type": "主旨大意题",
    "targetSentences": [
      "P1-S1",
      "P2-S1"
    ],
    "verbatimEvidence": null,
    "synonymMapping": null,
    "methodologyReview": {
      "trapAnalysis": "第 39 题重点考查定位句与选项之间的同义替换精准度，注意排除干扰项的干扰特征。",
      "methodSummary": "细节题直选与排除法则：抓准题干核心关键词快速定位，对比定位句语义，排除无中生有与偷换概念选项。"
    },
    "paperVariants": null,
    "rawFields": {
      "stemKeywords": [
        "Juggling",
        "life",
        "probably"
      ]
    },
    "provenance": {
      "sourceLayer": "production",
      "sourceFile": "题库/英语/data_2001.js",
      "year": 2001,
      "articleKey": "ky-en1-2001-r-t5",
      "extractedAt": "2026-09-18T23:13:00+0800",
      "contentHash": "sha256:5a2c1911d69a28b8b824d35c5138024b9b11ad53f32aa3c4864cafb447a302fd"
    }
  },
  {
    "schemaVersion": "kaoyan-existing-question-1.0",
    "source": "production",
    "articleKey": "ky-en1-2001-r-t5",
    "qIndex": 40,
    "questionNumber": 40,
    "stem": "According to the passage, downshifting emerged in the U.S. as a result of _____",
    "stemTranslation": null,
    "options": [
      {
        "key": "A",
        "text": "the quick pace of modern life",
        "isCorrect": false,
        "distractorType": "无中生有",
        "analysis": "【干扰特征: 无中生有】选项 A 违背原文细节，存在明显的逻辑偏差或概念偷换。",
        "refSentences": [
          "P1-S1",
          "P2-S1"
        ]
      },
      {
        "key": "B",
        "text": "man's adventurous spirit",
        "isCorrect": false,
        "distractorType": "过度推断",
        "analysis": "【干扰特征: 过度推断】选项 B 违背原文细节，存在明显的逻辑偏差或概念偷换。",
        "refSentences": [
          "P1-S1",
          "P2-S1"
        ]
      },
      {
        "key": "C",
        "text": "man's search for mythical experiences",
        "isCorrect": true,
        "distractorType": null,
        "analysis": "【正确项 · 同义替换】选项 C 严格遵循题干定位句的核心事实逻辑，通过同义表达精准契合原文论断。",
        "refSentences": [
          "P1-S1",
          "P2-S1"
        ]
      },
      {
        "key": "D",
        "text": "the economic situation ##",
        "isCorrect": false,
        "distractorType": "偷换概念",
        "analysis": "【干扰特征: 偷换概念】选项 D 违背原文细节，存在明显的逻辑偏差或概念偷换。",
        "refSentences": [
          "P1-S1",
          "P2-S1"
        ]
      }
    ],
    "officialAnswer": "C",
    "standardType": null,
    "type": "观点态度题",
    "targetSentences": [
      "P1-S1",
      "P2-S1"
    ],
    "verbatimEvidence": null,
    "synonymMapping": null,
    "methodologyReview": {
      "trapAnalysis": "第 40 题重点考查定位句与选项之间的同义替换精准度，注意排除干扰项的干扰特征。",
      "methodSummary": "细节题直选与排除法则：抓准题干核心关键词快速定位，对比定位句语义，排除无中生有与偷换概念选项。"
    },
    "paperVariants": null,
    "rawFields": {
      "stemKeywords": [
        "According",
        "passage",
        "downshifting"
      ]
    },
    "provenance": {
      "sourceLayer": "production",
      "sourceFile": "题库/英语/data_2001.js",
      "year": 2001,
      "articleKey": "ky-en1-2001-r-t5",
      "extractedAt": "2026-09-18T23:13:00+0800",
      "contentHash": "sha256:5a2c1911d69a28b8b824d35c5138024b9b11ad53f32aa3c4864cafb447a302fd"
    }
  }
]